{
	"$schema": "http://json-schema.org/draft-04/schema#",
	"$ref": "#/definitions/ceterms:CostManifest",
	"definitions": {
		"@context": {
			"type": "string",
			"enum": [
				"http://credreg.net/ctdl/schema/context/json"
			]
		},
		"@id": {
			"type": "string"
		},
		"@id_multi": {
			"type": "array",
			"items": {
				"$ref": "#/definitions/@id"
			}
		},
		"@id_absolute": {
			"type": "string",
			"format": "uri"
		},
		"@id_absolute_multi": {
			"type": "array",
			"items": {
				"$ref": "#/definitions/@id_absolute"
			}
		},
		"meta:string": {
			"type": "string"
		},
		"meta:string_multi": {
			"type": "array",
			"items": {
				"$ref": "#/definitions/meta:string"
			}
		},
		"meta:langstring": {
			"type": "string"
		},
		"meta:langstring_multi": {
			"type": "array",
			"items": {
				"$ref": "#/definitions/meta:langstring"
			}
		},
		"meta:literal_object": {
			"type": "object",
			"properties": {
				"@id": {
					"$ref": "#/definitions/@id"
				},
				"@value": {
					"$ref": "#/definitions/meta:string"
				},
				"@language": {
					"$ref": "#/definitions/meta:string"
				}
			}
		},
		"meta:literal": {
			"anyOf": [
				{
					"$ref": "#/definitions/meta:string"
				},
				{
					"$ref": "#/definitions/meta:literal_object"
				}
			]
		},
		"meta:literal_multi": {
			"type": "array",
			"items": {
				"$ref": "#/definitions/meta:literal"
			}
		},
		"ceterms:CostManifest": {
			"type": "object",
			"properties": {
				"@type": {
					"enum": [
						"ceterms:CostManifest"
					]
				},
				"@context": {
					"$ref": "#/definitions/@context"
				},
				"@id": {
					"$ref": "#/definitions/@id"
				},
				"ceterms:costDetails": {
					"$ref": "#/definitions/ceterms:costDetails"
				},
				"ceterms:costManifestOf": {
					"$ref": "#/definitions/ceterms:costManifestOf"
				},
				"ceterms:ctid": {
					"$ref": "#/definitions/ceterms:ctid"
				},
				"ceterms:description": {
					"$ref": "#/definitions/ceterms:description"
				},
				"ceterms:endDate": {
					"$ref": "#/definitions/ceterms:endDate"
				},
				"ceterms:estimatedCost": {
					"$ref": "#/definitions/ceterms:estimatedCost"
				},
				"ceterms:name": {
					"$ref": "#/definitions/ceterms:name"
				},
				"ceterms:startDate": {
					"$ref": "#/definitions/ceterms:startDate"
				}
			},
			"required": [
				"@type",
				"@id",
				"ceterms:costDetails",
				"ceterms:costManifestOf",
				"ceterms:ctid",
				"ceterms:description"
			],
			"additionalProperties": false
		},
		"ceterms:CostProfile": {
			"type": "object",
			"properties": {
				"@type": {
					"enum": [
						"ceterms:CostProfile"
					]
				},
				"ceterms:audienceType": {
					"$ref": "#/definitions/ceterms:audienceType"
				},
				"ceterms:condition": {
					"$ref": "#/definitions/ceterms:condition"
				},
				"ceterms:costDetails": {
					"$ref": "#/definitions/ceterms:costDetails"
				},
				"ceterms:currency": {
					"$ref": "#/definitions/ceterms:currency"
				},
				"ceterms:description": {
					"$ref": "#/definitions/ceterms:description"
				},
				"ceterms:directCostType": {
					"$ref": "#/definitions/ceterms:directCostType"
				},
				"ceterms:endDate": {
					"$ref": "#/definitions/ceterms:endDate"
				},
				"ceterms:jurisdiction": {
					"$ref": "#/definitions/ceterms:jurisdiction"
				},
				"ceterms:name": {
					"$ref": "#/definitions/ceterms:name"
				},
				"ceterms:paymentPattern": {
					"$ref": "#/definitions/ceterms:paymentPattern"
				},
				"ceterms:price": {
					"$ref": "#/definitions/ceterms:price"
				},
				"ceterms:region": {
					"$ref": "#/definitions/ceterms:region"
				},
				"ceterms:residencyType": {
					"$ref": "#/definitions/ceterms:residencyType"
				},
				"ceterms:startDate": {
					"$ref": "#/definitions/ceterms:startDate"
				}
			},
			"required": [
				"@type",
				"ceterms:costDetails",
				"ceterms:description"
			],
			"additionalProperties": false
		},
		"ceterms:CredentialAlignmentObject": {
			"type": "object",
			"properties": {
				"@type": {
					"enum": [
						"ceterms:CredentialAlignmentObject"
					]
				},
				"ceterms:alignmentDate": {
					"$ref": "#/definitions/ceterms:alignmentDate"
				},
				"ceterms:alignmentType": {
					"$ref": "#/definitions/ceterms:alignmentType"
				},
				"ceterms:codedNotation": {
					"$ref": "#/definitions/ceterms:codedNotation"
				},
				"ceterms:framework": {
					"$ref": "#/definitions/ceterms:framework"
				},
				"ceterms:frameworkName": {
					"$ref": "#/definitions/ceterms:frameworkName"
				},
				"ceterms:targetNode": {
					"$ref": "#/definitions/ceterms:targetNode"
				},
				"ceterms:targetNodeDescription": {
					"$ref": "#/definitions/ceterms:targetNodeDescription"
				},
				"ceterms:targetNodeName": {
					"$ref": "#/definitions/ceterms:targetNodeName"
				},
				"ceterms:weight": {
					"$ref": "#/definitions/ceterms:weight"
				}
			},
			"required": [
				"@type",
				"ceterms:targetNodeName"
			],
			"additionalProperties": false
		},
		"ceterms:JurisdictionProfile": {
			"type": "object",
			"properties": {
				"@type": {
					"enum": [
						"ceterms:JurisdictionProfile"
					]
				},
				"ceterms:assertedBy": {
					"$ref": "#/definitions/ceterms:assertedBy"
				},
				"ceterms:description": {
					"$ref": "#/definitions/ceterms:description"
				},
				"ceterms:globalJurisdiction": {
					"$ref": "#/definitions/ceterms:globalJurisdiction"
				},
				"ceterms:jurisdictionException": {
					"$ref": "#/definitions/ceterms:jurisdictionException"
				},
				"ceterms:mainJurisdiction": {
					"$ref": "#/definitions/ceterms:mainJurisdiction"
				}
			},
			"required": [
				"@type"
			],
			"additionalProperties": false
		},
		"ceterms:Place": {
			"type": "object",
			"properties": {
				"@type": {
					"enum": [
						"ceterms:Place"
					]
				},
				"ceterms:addressCountry": {
					"$ref": "#/definitions/ceterms:addressCountry"
				},
				"ceterms:addressLocality": {
					"$ref": "#/definitions/ceterms:addressLocality"
				},
				"ceterms:addressRegion": {
					"$ref": "#/definitions/ceterms:addressRegion"
				},
				"ceterms:description": {
					"$ref": "#/definitions/ceterms:description"
				},
				"ceterms:geoURI": {
					"$ref": "#/definitions/ceterms:geoURI"
				},
				"ceterms:latitude": {
					"$ref": "#/definitions/ceterms:latitude"
				},
				"ceterms:longitude": {
					"$ref": "#/definitions/ceterms:longitude"
				},
				"ceterms:name": {
					"$ref": "#/definitions/ceterms:name"
				},
				"ceterms:postalCode": {
					"$ref": "#/definitions/ceterms:postalCode"
				},
				"ceterms:postOfficeBoxNumber": {
					"$ref": "#/definitions/ceterms:postOfficeBoxNumber"
				},
				"ceterms:streetAddress": {
					"$ref": "#/definitions/ceterms:streetAddress"
				},
				"ceterms:targetContactPoint": {
					"$ref": "#/definitions/ceterms:targetContactPoint"
				}
			},
			"required": [
				"@type"
			],
			"additionalProperties": false
		},
		"ceterms:ContactPoint": {
			"type": "object",
			"properties": {
				"@type": {
					"enum": [
						"ceterms:ContactPoint"
					]
				},
				"ceterms:contactOption": {
					"$ref": "#/definitions/ceterms:contactOption"
				},
				"ceterms:contactType": {
					"$ref": "#/definitions/ceterms:contactType"
				},
				"ceterms:email": {
					"$ref": "#/definitions/ceterms:email"
				},
				"ceterms:faxNumber": {
					"$ref": "#/definitions/ceterms:faxNumber"
				},
				"ceterms:name": {
					"$ref": "#/definitions/ceterms:name"
				},
				"ceterms:socialMedia": {
					"$ref": "#/definitions/ceterms:socialMedia"
				},
				"ceterms:telephone": {
					"$ref": "#/definitions/ceterms:telephone"
				}
			},
			"required": [
				"@type"
			],
			"additionalProperties": false
		},
		"ceterms:costDetails": {
			"$ref": "#/definitions/@id_absolute"
		},
		"ceterms:costManifestOf": {
			"$ref": "#/definitions/pointer:constraint:ReferenceOrganization"
		},
		"ceterms:ctid": {
			"$ref": "#/definitions/meta:string"
		},
		"ceterms:description": {
			"$ref": "#/definitions/meta:langstring"
		},
		"ceterms:endDate": {
			"$ref": "#/definitions/meta:string"
		},
		"ceterms:estimatedCost": {
			"type": "array",
			"items": {
				"$ref": "#/definitions/ceterms:CostProfile"
			}
		},
		"ceterms:name": {
			"$ref": "#/definitions/meta:langstring"
		},
		"ceterms:startDate": {
			"$ref": "#/definitions/meta:string"
		},
		"ceterms:audienceType": {
			"type": "array",
			"items": {
				"$ref": "#/definitions/ceterms:CredentialAlignmentObject"
			}
		},
		"ceterms:condition": {
			"$ref": "#/definitions/meta:langstring_multi"
		},
		"ceterms:currency": {
			"$ref": "#/definitions/meta:string"
		},
		"ceterms:directCostType": {
			"type": "array",
			"items": {
				"$ref": "#/definitions/ceterms:CredentialAlignmentObject"
			}
		},
		"ceterms:jurisdiction": {
			"type": "array",
			"items": {
				"$ref": "#/definitions/ceterms:JurisdictionProfile"
			}
		},
		"ceterms:paymentPattern": {
			"$ref": "#/definitions/meta:langstring"
		},
		"ceterms:price": {
			"type": "number"
		},
		"ceterms:region": {
			"type": "array",
			"items": {
				"$ref": "#/definitions/ceterms:Place"
			}
		},
		"ceterms:residencyType": {
			"type": "array",
			"items": {
				"$ref": "#/definitions/ceterms:CredentialAlignmentObject"
			}
		},
		"ceterms:alignmentDate": {
			"$ref": "#/definitions/meta:string"
		},
		"ceterms:alignmentType": {
			"$ref": "#/definitions/meta:string"
		},
		"ceterms:codedNotation": {
			"$ref": "#/definitions/meta:string"
		},
		"ceterms:framework": {
			"$ref": "#/definitions/@id_absolute"
		},
		"ceterms:frameworkName": {
			"$ref": "#/definitions/meta:langstring"
		},
		"ceterms:targetNode": {
			"$ref": "#/definitions/@id_absolute"
		},
		"ceterms:targetNodeDescription": {
			"$ref": "#/definitions/meta:langstring"
		},
		"ceterms:targetNodeName": {
			"$ref": "#/definitions/meta:langstring"
		},
		"ceterms:weight": {
			"type": "number"
		},
		"ceterms:assertedBy": {
			"$ref": "#/definitions/pointer:constraint:ReferenceOrganization"
		},
		"ceterms:globalJurisdiction": {
			"type": "boolean"
		},
		"ceterms:jurisdictionException": {
			"type": "array",
			"items": {
				"$ref": "#/definitions/ceterms:Place"
			}
		},
		"ceterms:mainJurisdiction": {
			"type": "array",
			"items": {
				"$ref": "#/definitions/ceterms:Place"
			}
		},
		"ceterms:addressCountry": {
			"$ref": "#/definitions/meta:langstring"
		},
		"ceterms:addressLocality": {
			"$ref": "#/definitions/meta:langstring"
		},
		"ceterms:addressRegion": {
			"$ref": "#/definitions/meta:langstring"
		},
		"ceterms:geoURI": {
			"$ref": "#/definitions/@id_absolute"
		},
		"ceterms:latitude": {
			"type": "number"
		},
		"ceterms:longitude": {
			"type": "number"
		},
		"ceterms:postalCode": {
			"$ref": "#/definitions/meta:string"
		},
		"ceterms:postOfficeBoxNumber": {
			"$ref": "#/definitions/meta:string"
		},
		"ceterms:streetAddress": {
			"$ref": "#/definitions/meta:langstring"
		},
		"ceterms:targetContactPoint": {
			"type": "array",
			"items": {
				"$ref": "#/definitions/ceterms:ContactPoint"
			}
		},
		"ceterms:contactOption": {
			"$ref": "#/definitions/meta:langstring_multi"
		},
		"ceterms:contactType": {
			"$ref": "#/definitions/meta:langstring"
		},
		"ceterms:email": {
			"$ref": "#/definitions/meta:string_multi"
		},
		"ceterms:faxNumber": {
			"$ref": "#/definitions/meta:string_multi"
		},
		"ceterms:socialMedia": {
			"$ref": "#/definitions/@id_absolute_multi"
		},
		"ceterms:telephone": {
			"$ref": "#/definitions/meta:string_multi"
		},
		"pointer:constraint:ReferenceOrganization": {
			"anyOf": [
				{
					"type": "array",
					"properties": {
						"@id": {
							"$ref": "#/definitions/@id_absolute"
						}
					},
					"required": [
						"@id"
					],
					"additionalProperties": false
				},
				{
					"type": "array",
					"properties": {
						"@type": {
							"enum": [
								"ceterms:CredentialOrganization",
								"ceterms:QACredentialOrganization"
							]
						},
						"ceterms:name": {
							"$ref": "#/definitions/ceterms:name"
						},
						"ceterms:description": {
							"$ref": "#/definitions/ceterms:description"
						},
						"ceterms:subjectWebpage": {
							"$ref": "#/definitions/ceterms:subjectWebpage"
						},
						"ceterms:socialMedia": {
							"$ref": "#/definitions/ceterms:socialMedia"
						}
					},
					"required": [
						"@type"
					],
					"additionalProperties": false
				}
			]
		}
	}
}
