[{"@context":"http://credreg.net/ctdl/schema/context/json","@id":"http://lr-staging.learningtapestry.com/resources/ce-7697332f-97d1-47a3-80b0-158f0140761c","@type":"ceterms:CostManifest","ceterms:costDetails":"https://financialaid.sf.edu/tuition-fees","ceterms:costManifestOf":[{"@id":"http://lr-staging.learningtapestry.com/resources/ce-a799a6db-1544-493b-9d73-978ea112beec"}],"ceterms:ctid":"ce-7697332f-97d1-47a3-80b0-158f0140761c","ceterms:description":"As one of the lowest priced private universities in the state, USF represents a tremendous value and is a wonderful investment in your future.  Most students, even those who may not have financial need, receive scholarships at the University of Saint Francis. In addition, funds from state and federal grants, private scholarships, loans and work-study may be available for you.","ceterms:estimatedCost":[{"@type":"ceterms:CostProfile","ceterms:audienceType":[{"@type":"ceterms:CredentialAlignmentObject","ceterms:framework":"Audience","ceterms:targetNode":"audience:FullTime","ceterms:targetNodeName":"Full-Time"}],"ceterms:costDetails":"https://financialaid.sf.edu/paying-for-college/net-price-calculator/","ceterms:description":"The University of Saint Francis is committed to making education as affordable as possible. The only application USF requires to determine financial aid eligibility is the FAFSA (Free Application for Federal Student Aid). The FAFSA is available every year after October 1 and should be completed prior to April 15 prior to the start of an academic year to ensure students receive the maximum amount of aid for which they are eligible. Prior to being able to apply for financial aid, we want to afford students the opportunity to determine an estimate of their financial aid eligibility prior to the FAFSA being made available. Please complete the appropriate Net Price Calculator to see how affordable USF can be.","ceterms:directCostType":[{"@type":"ceterms:CredentialAlignmentObject","ceterms:framework":"CostType","ceterms:targetNode":"costType:Tuition","ceterms:targetNodeName":"Tuition"}],"ceterms:name":" Net Price Calculator","ceterms:paymentPattern":"Tuition for 12-18 credit hours","ceterms:price":28390.0}],"ceterms:name":"Tuition and Fees (Undergraduate)"},{"@context":"http://credreg.net/ctdl/schema/context/json","@id":"http://lr-staging.learningtapestry.com/resources/ce-1188ddc3-84b0-42ed-9db0-62b80a06016a","@type":"ceterms:CostManifest","ceterms:costDetails":"https://www.elon.edu/e/admissions/undergraduate/financial-aid/index.html","ceterms:costManifestOf":[{"@id":"http://lr-staging.learningtapestry.com/resources/ce-33b14188-1871-4d75-b065-45cf7edeece4"}],"ceterms:ctid":"ce-1188ddc3-84b0-42ed-9db0-62b80a06016a","ceterms:description":"Elon University is committed to providing an exceptional education at a reasonable cost.","ceterms:estimatedCost":[{"@type":"ceterms:CostProfile","ceterms:audienceType":[{"@type":"ceterms:CredentialAlignmentObject","ceterms:framework":"Audience","ceterms:targetNode":"audience:CurrentStudent","ceterms:targetNodeName":"Current Student"}],"ceterms:costDetails":"https://www.elon.edu/e/admissions/undergraduate/financial-aid/index.html","ceterms:currency":"US Dollar","ceterms:description":"For federal financial aid purposes, indirect costs including books, transportation, and miscellaneous expenses (set at $3,500) are added to tuition, fees, room, and board to determine Elon Universityâ€™s official total cost of attendance, which is $49,642 for 2017-2018.\n\n","ceterms:directCostType":[{"@type":"ceterms:CredentialAlignmentObject","ceterms:framework":"CostType","ceterms:targetNode":"costType:AggregateCost","ceterms:targetNodeName":"Aggregate Cost"}],"ceterms:name":"Cost","ceterms:paymentPattern":"For 2017-2018","ceterms:price":49642.0}],"ceterms:name":"Elon University Tuition and Fees"},{"@context":"http://credreg.net/ctdl/schema/context/json","@id":"http://lr-staging.learningtapestry.com/resources/ce-f7066346-3e85-4d2c-bf1c-6919ab816800","@type":"ceterms:CostManifest","ceterms:costDetails":"http://www.energymanagementassociation.org/training/empprocessseminar.aspx","ceterms:costManifestOf":[{"@id":"http://lr-staging.learningtapestry.com/resources/ce-77f9fd94-9219-4346-bbb8-326f0d84e5e5"}],"ceterms:ctid":"ce-f7066346-3e85-4d2c-bf1c-6919ab816800","ceterms:description":"EMP certification is available to industry professionals who are responsible for managing and continually improving energy performance in commercial buildings. The scope of the EMP program is aligned with the Energy Management Professional consensus qualifications guidelines established by the U.S. Department of Energy.\n\nEMP certificants:\n\nPlan effective energy management\n\nManage energy information\n\nImplement energy management programs\n\nManage budgets and finances\n\nImplement energy efficient projects\n\nManage energy communications","ceterms:estimatedCost":[{"@type":"ceterms:CostProfile","ceterms:audienceType":[{"@type":"ceterms:CredentialAlignmentObject","ceterms:framework":"Audience","ceterms:targetNode":"audience:FullTime","ceterms:targetNodeName":"Full-Time"},{"@type":"ceterms:CredentialAlignmentObject","ceterms:framework":"Audience","ceterms:targetNode":"audience:PublicEmployee","ceterms:targetNodeName":"Public Employee"}],"ceterms:costDetails":"http://www.energymanagementassociation.org/training/empprocessseminar.aspx","ceterms:currency":"US Dollar","ceterms:description":"Individuals employed by an EMA member company, or by a company that has submitted a completed application EMP Application \u0026 Exam Fee $500. All other individuals, $750.","ceterms:directCostType":[{"@type":"ceterms:CredentialAlignmentObject","ceterms:framework":"CostType","ceterms:targetNode":"costType:Application","ceterms:targetNodeName":"Application"}],"ceterms:name":" EMA Employee","ceterms:price":500.0},{"@type":"ceterms:CostProfile","ceterms:audienceType":[{"@type":"ceterms:CredentialAlignmentObject","ceterms:framework":"Audience","ceterms:targetNode":"audience:FullTime","ceterms:targetNodeName":"Full-Time"},{"@type":"ceterms:CredentialAlignmentObject","ceterms:framework":"Audience","ceterms:targetNode":"audience:PublicEmployee","ceterms:targetNodeName":"Public Employee"}],"ceterms:costDetails":"http://www.energymanagementassociation.org/training/empprocessseminar.aspx","ceterms:currency":"US Dollar","ceterms:description":"Application costs for Non-EMA Employees","ceterms:directCostType":[{"@type":"ceterms:CredentialAlignmentObject","ceterms:framework":"CostType","ceterms:targetNode":"costType:Application","ceterms:targetNodeName":"Application"}],"ceterms:name":" Non-EMA Employees","ceterms:price":750.0}],"ceterms:name":"Certification Fees"},{"@context":"http://credreg.net/ctdl/schema/context/json","@id":"http://lr-staging.learningtapestry.com/resources/ce-4fd52c37-f0d0-4499-b3e7-8c37a865fc3d","@type":"ceterms:CostManifest","ceterms:costDetails":"http://www.tstc.edu/admissions/tuition?_ga=2.67757458.206721200.1501095680-1754683349.1501095680","ceterms:costManifestOf":[{"@id":"http://lr-staging.learningtapestry.com/resources/ce-3cee9a46-97a7-41f2-955b-0220c4cead5a"}],"ceterms:ctid":"ce-4fd52c37-f0d0-4499-b3e7-8c37a865fc3d","ceterms:description":"The cost of attending Texas State Technical College (TSTC) varies depending on a variety of factors, such as residency status, whether or you live on campus, the program of study and any other services that you may need. You may be eligible for financial assistance which can help provide the financial support for tuition, housing, books and other educational items.","ceterms:estimatedCost":[{"@type":"ceterms:CostProfile","ceterms:costDetails":"http://www.tstc.edu/admissions/tuition","ceterms:currency":"US Dollar","ceterms:description":"The cost of attending Texas State Technical College (TSTC) varies depending on a variety of factors, such as residency status, whether or you live on campus, the program of study and any other services that you may need. You may be eligible for financial assistance which can help provide the financial support for tuition, housing, books and other educational items.\n\n","ceterms:directCostType":[{"@type":"ceterms:CredentialAlignmentObject","ceterms:framework":"CostType","ceterms:targetNode":"costType:Tuition","ceterms:targetNodeName":"Tuition"}],"ceterms:name":"In-State Tuition ","ceterms:paymentPattern":"Tier 1 (Biomedical Equipment Technology, Computer Networking \u0026 Security, Culinary Arts, Dental Hygiene, Diesel Equipment Technology, Electrical Power \u0026 Controls Technology, Instrumentation Technology, Lineworker, Registered Nursing, Welding Technology): per credit hour\n\n","ceterms:price":188.0,"ceterms:residencyType":[{"@type":"ceterms:CredentialAlignmentObject","ceterms:framework":"Residency","ceterms:targetNode":"residency:InState","ceterms:targetNodeName":"In-State"}]},{"@type":"ceterms:CostProfile","ceterms:costDetails":"http://www.tstc.edu/admissions/tuition","ceterms:currency":"US Dollar","ceterms:description":"The cost of attending Texas State Technical College (TSTC) varies depending on a variety of factors, such as residency status, whether or you live on campus, the program of study and any other services that you may need. You may be eligible for financial assistance which can help provide the financial support for tuition, housing, books and other educational items.\n\n","ceterms:directCostType":[{"@type":"ceterms:CredentialAlignmentObject","ceterms:framework":"CostType","ceterms:targetNode":"costType:Tuition","ceterms:targetNodeName":"Tuition"}],"ceterms:name":"In-State Tuition ","ceterms:paymentPattern":"Tier 2 (All technical classes not in Tier 1, All General Academic Courses): per credit hour","ceterms:price":166.0,"ceterms:residencyType":[{"@type":"ceterms:CredentialAlignmentObject","ceterms:framework":"Residency","ceterms:targetNode":"residency:InState","ceterms:targetNodeName":"In-State"}]},{"@type":"ceterms:CostProfile","ceterms:costDetails":"http://www.tstc.ed